title,link,description,cafename,cafeurl
미밴드2 수면측정 해봤습니다,http://cafe.naver.com/xst/95724,피곤하네요 ㅠㅠ 수면 측정 시간은 저녁 9시 12분에 시간을 보고 바로 누워서 자고 일어난 시간도 맞습니다 어제 오후 5시쯤에 배터리 충전해서 12시간정도 됐는데 심박 측정도 하고 알람도 쓰고 있는데 아직 배터리 100... ,샤오미스토리 - 가성비 유저 커뮤니티,https://cafe.naver.com/xst
수면측정 되게 신기하네요,http://cafe.naver.com/anycallusershow/4069147,애플워치 쓸때는 유료로 구입해야 잠자는패턴 등 상세정보를 확인할 수 있었는데 개발자가 업데이트를 안해주거나 이상하게 업뎃해서 그냥 돈 버리는 어플이였는데ㅠ 기본적으로 상세하게 알려주니 좋네요. 역시... ,삼성스마트폰-Z플립4/갤폴드4/갤럭시S...,https://cafe.naver.com/anycallusershow
잘때다른사람이착용하고자니 수면측정이 안됩니다ㅜㅜ,http://cafe.naver.com/xst/2095,아직까진 다행히도 알람.만보계.수면측정 모두잘 되고있는데요. 몇일전에 신랑 수면측정해보려고 잘때만 신랑이 차고 잤습니다. 다음날 확인해보니 미밴드를 착용하지 않았다는 메세지만 나옵니다.당연히 수면은 0으로... ,샤오미스토리 - 가성비 유저 커뮤니티,https://cafe.naver.com/xst
수면측정문의드립니다.,http://cafe.naver.com/xst/8425,어느순간 수면측정이안되네요. 고장인지 문의좀드릴게요.,샤오미스토리 - 가성비 유저 커뮤니티,https://cafe.naver.com/xst
처음 수면측정 해봤는데 암담하네요 ㅋㅋㅋㅋㅋ,http://cafe.naver.com/facebot/708035,6시간 잤는데 깊은 수면 0분 ㅋㅋㅋㅋㅋ 얕은 수면 4시간 렘수면 1시간반 뭐하러 잔거죠 ㅋㅋㅋㅋㅋ,갤럭시워치 커뮤니티 [갤럭시워치5 / ...,https://cafe.naver.com/facebot
"착용안하고, 일하고 있었는데 수면측정...",http://cafe.naver.com/anycallusershow/3781808,책상에 두고 일하다가 생각나서 봤더니 수면 중이었다고 나오면서 점수 나오는데... 도대체 무슨 일인거죠...,삼성스마트폰-Z플립4/갤폴드4/갤럭시S...,https://cafe.naver.com/anycallusershow
수면측정 하시는 분들 깊은 수면 보통 얼마나 나오세요?_?,http://cafe.naver.com/happy88car/146884,"제가 평일엔 5시간정도 자다가 오늘 주말이라 늦잠 잤는데도 깊은 수면 측정이 절망적이라 여쭤봅니다..ㅠㅅㅠ 제가 잠을 못자는건지, 심박으로는 측정이 잘 안되서 그런건지 궁금해서요- 다른분들은 몇시간 수면에 깊은... ",[스사노]스마트워치 사용자 노리터[타...,https://cafe.naver.com/happy88car
수면 측정해봤는데 재미있네요. ㅋ,http://cafe.naver.com/facebot/785296,신랑 코골이 아니고 제꺼 맞겠죵? 녹음도 되있더라구요. ㅎㅎ 제가 코를 심하게 고는줄 오늘 처음 알았네요. 워치4 재미있네요. 깊은수면이 없어서 맨날 피곤 한가? 또 어떤 기능들이 숨어 있을지 잘 찾아봐야겠네요.,갤럭시워치 커뮤니티 [갤럭시워치5 / ...,https://cafe.naver.com/facebot
수면측정 신기해요 !!,http://cafe.naver.com/facebot/717598,뭔가 정확한거 같아요 이런걸 어떻게측정하나 의심했는데 잠든시간이랑 깬시간 보니까 신기하네요,갤럭시워치 커뮤니티 [갤럭시워치5 / ...,https://cafe.naver.com/facebot
미밴드5 수면측정 정확한듯 해요,http://cafe.naver.com/xst/454369,제가 원래 REM 수면은 1시간 대 나오다가 오늘 3시간 나왔는데 다른 날과 다르게 꿈이 기억이 나네요. 그리고 어제 잠을 빨리 못 들어서 깊은 수면시간이 짧은 것도 나오는 거 보면 꽤 정확하니 맘에 드는군요.,샤오미스토리 - 가성비 유저 커뮤니티,https://cafe.naver.com/xst
수면 측정 잘되나요??,http://cafe.naver.com/happy88car/146004,기조에 미밴드2 사용하면서 수면 측정을 해왔기에 좀 이상하네요.... 분명이 측정은 되는데 잠든 시간이랑 깨어난 시간이 오묘하게 달라요 1시에 잠을 잤는데 측정은 2시반정도부터 시작하고 주말에 10시에 눈떠서... ,[스사노]스마트워치 사용자 노리터[타...,https://cafe.naver.com/happy88car
삼성헬스 수면시간 상단에 뜨게하는거요,http://cafe.naver.com/anycallusershow/4273393,제목에는 간략한 질문내용 표시 사용기종 : 노10플 질문내용 : (구체적으로): 삼성헬스 예전에 아침에 일어나면 수면시간이 자동으로 팝업인지 떴던거같은데 그거 어떻게하나요 삼성헬스들어가서 수면시간측정되게 셀정은... ,삼성스마트폰-Z플립4/갤폴드4/갤럭시S...,https://cafe.naver.com/anycallusershow
GTS 골드 수면측정 어떠세요?,http://cafe.naver.com/xst/455108,수면 상태가 안좋은건 알겠는데 골드만 유독 깊은수면 체크가 다른듯 하네요 패치도 없고..,샤오미스토리 - 가성비 유저 커뮤니티,https://cafe.naver.com/xst
만보동참과 수면측정,http://cafe.naver.com/swnolja/186912,만보측정해놓고 이틀째달성중입니다^^ 저도 처음보는 미밴드의 수면측정..손목에 팔찌처럼 항상차고자는데 전 푹~~~~잔다고 생각했는데 왠걸..첫날은 6시간중에 59분숙면을 취했구요.오늘은 그나마 조금더늘어서... ,"수영, 수영복과 함께하는 수영인의 놀...",https://cafe.naver.com/swnolja
샤오미미밴드5 샀어요~수면시간 측정하려구요,http://cafe.naver.com/tripworldwater/13602,수면시간 측정하는 기능이있더라구요~ 써보신분 계세요?,불면증/수면장애/우울증/수면제/숙면/...,https://cafe.naver.com/tripworldwater
sleep++ 어플 또는 수면측정에 대해서 부탁드립니다~,http://cafe.naver.com/appleiphone/3852570,sleep start누르고 일어나서는 sleep stop을 눌러야 된다고 하시는거 같기도 한데 그러면 아이폰에서 수면분석이 가능한건가요??? 혹시 자동 수면분석은 안되는건가요?? 아님 수면측정 워치 어플 추천해주실만한게 있을까요???,아사모 -[아이폰14 / Plus / Pro / Ma...,https://cafe.naver.com/appleiphone
수면측정이 이상합니다. 세부내역이 보이질 않네요,http://cafe.naver.com/finisherclub/5345,안녕하세요 저는 최근에 가민 피닉스5를 구입한 사람인데요 멀쩡히 잘 사용하고 있다가 오늘 수면측정 확인을 위해 메뉴를 진입해보니 아래 그림처럼 시간은 측정이 되었지만 세부내역이 확인되지않는 현상이... ,피니셔클럽,https://cafe.naver.com/finisherclub
수면 코골이 측정 권한 문의드립니다.,http://cafe.naver.com/anycallusershow/3823909,워치4 수면측정을 사용중인데 녹음이 안되어서 문의드립니다. 혹시 코골이 녹음 잘 되시는분들 권한설정에서 저장공간 권한 허용으로 하셨는지 확인 가능하실까요? 웨어러블 앱 말고 휴대폰의 설정-애플리케이션... ,삼성스마트폰-Z플립4/갤폴드4/갤럭시S...,https://cafe.naver.com/anycallusershow
오토슬립으로 첫 수면 측정,http://cafe.naver.com/appleiphone/6094513,저 오늘 이렇게 나왔는데 다른 오토슬립 쓰는 분들 어떻게 나오세요? 생각보다 깊은 수면은 길지 않네요 ㅋㅋ,"아사모 -[아이폰,아이폰13 / Pro / Ma...",https://cafe.naver.com/appleiphone
스파르탄 트레이나 수면 측정 이정도뿐이 안되는건가요?(사진),http://cafe.naver.com/suuntomania/67422,2만원짜리 샤오미도 수면측정하면 몇번을 뒤치덕거렸는지 심박수 패턴이라더지 자잘한 정보를보여주는데 순토는 그냥 수면시간만보여주네요?? 원래이런건가요? 스파르탄 트레이너 사용중 입니다,순토매니아 (SUUNTO MANIA),https://cafe.naver.com/suuntomania
애플워치 착용하고 수면측정할때 줄 추천좀 해주세영,http://cafe.naver.com/appleiphone/6932816,이번에 애플7 스뎅 사전예약해서 밀레니엄루프로 받을 예정인데요 저는 애플워치 받으면 잘때 계속 착용하면서 수면측정을 진행하고 싶은데 추천해주실만한 시계 밴드가 있을까요??,아사모 -[아이폰14 / Plus / Pro / Ma...,https://cafe.naver.com/appleiphone
순토 스파르탄 트레이너 수면측정 어떻게하나요??,http://cafe.naver.com/suuntomania/66685,수면측정 밤 12기부터 아침 7시까지 설정하고 잤는데 앱으로보면 수면패턴이저장이안되어킬네요??,순토매니아 (SUUNTO MANIA),https://cafe.naver.com/suuntomania
수면측정방법,http://cafe.naver.com/facebot/883147,사용기종 : 갤워치4 질문내용(구체적으로) : 수면기록이 착용하고 자고 있으면 기본적으로 기록이 되는것 아닌가요? 처음에 잘되다가 어느순간 차고자도 기록이 하나도 안되네요 여기저기 찾아봐도 안보이고 어렵네요..,갤럭시워치 커뮤니티 [갤럭시워치5 / ...,https://cafe.naver.com/facebot
기어s3 수면측정...,http://cafe.naver.com/happy88car/119727,기어로 처음 수면시 착용하고 수면측정해봤는데 결과가 이렇네요.. 뭐 비교할 사람이없으니 이게 제가 잘자는 편인지 아닌지 궁금하네요..ㅎ 사용 해보신분들은 어떠세요?,[스사노]스마트워치 사용자 노리터[타...,https://cafe.naver.com/happy88car
수면측정 잘 되시나요,http://cafe.naver.com/happy88car/154637,수면측정 잘 되시나요 워치를 착용한 상태에서 수면응 해야하는데 배터리 문제는 어떻게 하나요 저는 아침에 완충이 되는게 기분이 좋아서요 ㅜㅠ,[스사노]스마트워치 사용자 노리터[타...,https://cafe.naver.com/happy88car
gts2 mini rem 수면 질문,http://cafe.naver.com/xst/546949,혹시 rem 수면 측정하려면 어떻게 해야될까요..?,샤오미스토리 - 가성비 유저 커뮤니티,https://cafe.naver.com/xst
수면측정이랑 손씻기,http://cafe.naver.com/appleiphone/6348693,수면측정하려고 했는데 자고 일어나니 하나도 측정이 되지 않았는데 혹시 뭐 따로 설정해야되는게 있나요?? 손씻기 자동타이머 설정했는데 한 1분은 씻고 있어야 타이머가 나오는데 원래 이런건가요...? 워치사용이... ,아사모 -[아이폰14 / Plus / Pro / Ma...,https://cafe.naver.com/appleiphone
미밴드5 수면측정 안됨,http://cafe.naver.com/xst/443430,미밴드5 오늘 받고 심박수/수면체크 기능 10분으로 켜고 오후에 2시간정도 낮잠 자봤는데 기록이 안 되어있네요... 혹시 자동이 아니라 따로 사용법이 있는 건가요?,샤오미스토리 - 가성비 유저 커뮤니티,https://cafe.naver.com/xst
애플워치 수면측정 어케하나요?,http://cafe.naver.com/appleiphone/7403210,아무설정없이 그냥 끼고 자면 되나요?,아사모 -[아이폰14 / Plus / Pro / Ma...,https://cafe.naver.com/appleiphone
울트라 배터리 자랑,http://cafe.naver.com/appleiphone/7553801,수면 측정은 안하고 AOD켜진상태로 사용하는데 너무 좋네요! 워치3 쓰다 넘어온 사람에겐 정말 신세계..,아사모 -[아이폰14 / Plus / Pro / Ma...,https://cafe.naver.com/appleiphone
처음으로 애플시계로… 수면,http://cafe.naver.com/appleiphone/7335959,수면 측정을 했는데 결과를 아이폰 에서 어디로 가면 수면측정 결과를 알 수 있는지요.,아사모 -[아이폰14 / Plus / Pro / Ma...,https://cafe.naver.com/appleiphone
수면기록이 안되요....,http://cafe.naver.com/facebot/979723,사용기종 : 갤럭시 워치4 질문내용(구체적으로) : 워치4 사고 몇달동안 수면 측정 잘하고 있었는데 며칠전부터 수면 측정이 안되고 있어요...ㅠㅠ 워치 껐다가 껴도 안되는데 이거 어찌 하나요???? 아무것도 건드린게... ,갤럭시워치 커뮤니티 [갤럭시워치5 / ...,https://cafe.naver.com/facebot
gtr3 pro 배터리 정상일까요?,http://cafe.naver.com/xst/571908,"심박측정 1분마다 자동운동감지 걷기만 민감하게(하루 자동감지 5분씩 3회정도 되는듯) aod 켬 손목들어올려 화면켜기 켬 카톡 등 앱 10가지 정도 알림설정(카톡 외에 알림은 하루 10회정도) 수면측정, 수면호흡질 켬... ",샤오미스토리 - 가성비 유저 커뮤니티,https://cafe.naver.com/xst
워치4 수면 관련 추가기능 좋네요,http://cafe.naver.com/anycallusershow/3780597,"저같은 경우는 수면중 혈중산소농도가 떨어져서 낮에 좀 피곤하고 이런게 있어서 수면다원검사도 받고 했었거든요. 기존 워치3에서는 혈중산소농도를 사용자가 직접 컨트롤 해서 측정했었는데, 워치4에서는 자동으로... ",삼성스마트폰-Z플립4/갤폴드4/갤럭시S...,https://cafe.naver.com/anycallusershow
수면측정시 와치착용 위치요?,http://cafe.naver.com/facebot/816993,사용기종 : 갤럭시 와치 4 질문내용(구체적으로) : 수면측정을 하고 싶은데 잘때 손에 뭔가 차있으면 불편해요. 측정은 하고싶고 손에는 차기 싫은데 발목에 차도 측정이 잘 될까요? 해보신분 계신가요?,갤럭시워치 커뮤니티 [갤럭시워치5 / ...,https://cafe.naver.com/facebot
"블투, 와이파이 둘 다 꺼도 수면모드",http://cafe.naver.com/anycallusershow/4098910,"워치까지 표시가 뜨더라구요 (음표표시) 블투, 와이파이 둘 다 꺼도 수면 측정 되는거 맞나요? 배터리가 밤새 많이 닳는다는 글을 많이 봐서 와이파이, 블투, 취침모드, 방해모드 등 불필요한 것들은 다 끄려고 합니다",삼성스마트폰-Z플립4/갤폴드4/갤럭시S...,https://cafe.naver.com/anycallusershow
수면측정해보신분~,http://cafe.naver.com/happy88car/248784,삼성헬스에서 입력하고 그냥 착용하고 자면되는건가요? 측정이 잘되는건지요,[스사노]스마트워치 사용자 노리터[타...,https://cafe.naver.com/happy88car
가민 수면 앱...,http://cafe.naver.com/finisherclub/48092,미밴드를 사용 하시던 유저분들의 미밴드 수면측정 정확도에 극찬을 합니다 이 앱은 자다가 화장실 다녀온 시간까지 정확하게 기록이 됩니다 심박을 오랜시간을 사용하면 화상의 위험성도 있죠 저는 눈부심 때문에... ,피니셔클럽,https://cafe.naver.com/finisherclub
애플워치 울트라 하루 사용,http://cafe.naver.com/appleiphone/7480943,어제 올랜도 매장에서 받아온 후 밤새 착용하고 취침 - 수면 측정 때문에 늘 차고 잡니다. - 술 많이 마신 날 심박수 높다고 경고도 해주니 더욱 좋구요. 배터리 소모 속도입니다. 저녁 19:30 완충 아침 07시 기상 - 잔량... ,아사모 -[아이폰14 / Plus / Pro / Ma...,https://cafe.naver.com/appleiphone
미밴드1S 수면측정 동기화시 일어난시간이 올라가는 현상,http://cafe.naver.com/xst/50109,아울러 기존에 구형 미밴드도 착용해서 사용중이었구요.요근래에 수면측정이 이상한 듯 해서 다른 분들도 동일하신지를 여쭤보고자 글을 남깁니다. 예시를 들겠습니다. 7시에 기상해서 수면측정 기록을 보면... ,샤오미스토리 - 가성비 유저 커뮤니티,https://cafe.naver.com/xst
수면측정은되는데 어플에 표시가 안됩니다...,http://cafe.naver.com/suuntomania/67113,시계로수면측정은됩니다. 전에 수면측정하고 스마트폰 어플에 그래프로 표사가됬던거같은데 오랜만에하니 표시가 안되네요...,순토매니아 (SUUNTO MANIA),https://cafe.naver.com/suuntomania
수면측정중에 연결끊긴경우 없었나요?,http://cafe.naver.com/anycallusershow/3831107,워치4사용중인데 수면측정할겸 워치차고자는데 이상하게 아침에 폰과 연결이 끊긴경우가 생기네요 분명히 자기전에는 정상적으로 연결이 되어있었는데 아침에 폰은 알람이 울리는데 워치는 조용해서 보면 연결이... ,삼성스마트폰-Z플립4/갤폴드4/갤럭시S...,https://cafe.naver.com/anycallusershow
갤럭시 워치5 10% 이상 할인받고 싸게 사는 법,http://cafe.naver.com/dowajo/1330463,"더 정확해진 수면 측정 기능으로 수면 패턴을 분석할 수 있습니다. 8개의 동물 유형으로 수면 패턴을 보여줍니다. 취침 시간을 계획할 수 있고 코골이를 감지합니다. 수면단계(수면 중 깸, 깊은 수면, 얕은 수면... ",PC초보 컴퓨터 문제해결 카페-이젠 부...,https://cafe.naver.com/dowajo
애플워치 수면모드 연동 오동작???,http://cafe.naver.com/appleiphone/7111993,안녕하세요 워치7 사용하면서 AutoSleep 앱으로 수면 측정하며 사용 중입니다. 취침시간으로 설정해 놓은 시간이 되면 자동으로 방해금지모드(수면모드)로 설정되는데 이때 문제가 화면이 꺼지질 않습니다.. AOD가 계속... ,아사모 -[아이폰14 / Plus / Pro / Ma...,https://cafe.naver.com/appleiphone
수면 측정 어플 질문인데요,http://cafe.naver.com/appleiphone/2982519,예전에 아이폰4 쓰던시절에 수면 측정 및 녹음이 되는 어플이있었는데 저는그게 sleep cycle 인줄 알았는데 분석은되도 녹음이 안되네요 두개다 되는 어플이 먼지 궁금해요!,아사모 -[아이폰14 / Plus / Pro / Ma...,https://cafe.naver.com/appleiphone
혹시 애플워치수면어플 측정 잘될까요?,http://cafe.naver.com/2003000/11261,그 아이폰에 건강 어플보면 수면분석이라는게 있잖아요 그래서 저도 애플워치로 수면어플 사용해서 한번 해보려고 했는데 적합하지 않다는 사람들도 많아서요 찾아보니까 애플이 의도한게 자는동안 애플워치를... ,애페모-스마트/애플워치/페이스/스트랩...,https://cafe.naver.com/2003000
워치 수면기능 정확한걸까요. .,http://cafe.naver.com/ira111/624375,"요 며칠 수면기능 체크해본다고 차고 잤는데요 수면체크해보면 이런식으로 얕은수면이 대부분이고 깊은수면 조금. . 근데 지금 진짜 자도자도 피곤함이 풀리진 않거든요 한달전부터 밀크씨슬, 비타민 먹어보니 조금... ",미사강변도시 미사맘스클럽♡ 미사맘,https://cafe.naver.com/ira111
애플워치 수면모드 오동작 ??,http://cafe.naver.com/inmacbook/2502987,안녕하세요 워치7 사용하면서 AutoSleep 앱으로 수면 측정하며 사용 중입니다. 취침시간으로 설정해 놓은 시간이 되면 자동으로 방해금지모드(수면모드)로 설정되는데 이때 문제가 화면이 꺼지질 않습니다.. AOD가 계속... ,맥 쓰는 사람들 [구 맥북을 쓰는 사람...,https://cafe.naver.com/inmacbook
갤럭시 워치5 40mm 44mm 행사 가격으로 구입하는 방법,http://cafe.naver.com/dowajo/1330080,"갤럭시 워치5는 더 정확해진 수면 측정 기능으로 수면 상태를 정확하게 체크할 수 있습니다. 여러분의 수면 패턴을 8개의 동물 유형으로 분석해 줍니다. 코골이를 감지하고 수면 중 깸, 깊은 수면, 렘수면, 얕은... ",PC초보 컴퓨터 문제해결 카페-이젠 부...,https://cafe.naver.com/dowajo
갤워치4 수면측정을 해보았습니다.,http://cafe.naver.com/malltail/6367276,수면질이 영 아니네요 푹잔게 38분... 헐입니다 어쩐지 아침에 피곤함이 가시질 않고.. 어깨에 곰두마리... 코골이와 수면무호흡이 너무 심해 양압기사용하는데 와 코골이소리 만만치 않습니당ㅋ 정말 각방쓰기는 싫은데..... ,● 몰테일 스토리 - 쉽고 빠른 해외직...,https://cafe.naver.com/malltail
zepp app 업데이트 후 수면 측정 오류가 있네요,http://cafe.naver.com/xst/462895,집에 오면 시계을 벗어 놓고 있어서 수면 데이터가 항상 없었는데 어제 zepp app 업데이트 이후에는 시계를 벗어 놓은 시간부터 해서 아침에 시계를 차는 시간까지 수면으로 인식 했네요. (ZEPP E Circle 사용... ,샤오미스토리 - 가성비 유저 커뮤니티,https://cafe.naver.com/xst
애플 워치 차고 주무시나요?,http://cafe.naver.com/appleiphone/7467374,수면 측정이랑 알림 때문에 저는 차고 자는데 다른 분들은 어떤지 궁금해졌습니다,아사모 -[아이폰14 / Plus / Pro / Ma...,https://cafe.naver.com/appleiphone
배터리 사용시간,http://cafe.naver.com/facebot/1136101,중간에 충전하고 잘때 차고 자면 담날 출근할때는 배터리가 소모되서 결국 낮 시간에 배터리가 다 떨어질텐데.. 수면측정 기능은 있으나 실제 측정하기엔 배터리용량 한계로 어려운 기능일까요?,갤럭시워치 커뮤니티 [갤럭시워치5 / ...,https://cafe.naver.com/facebot
애플워치 수면 축정 관련(help me),http://cafe.naver.com/appleiphone/7404167,"렘수면,깊은수면 이런게 왜 체크가 안될까요? 워치 불량인가요?",아사모 -[아이폰14 / Plus / Pro / Ma...,https://cafe.naver.com/appleiphone
갤럭시핏2 수면측정이랑 알람 질문이요!,http://cafe.naver.com/anycallusershow/3517110,"갤럭시핏2 수면측정할 때 예를 들어 자다가 일어났다가 다시 잠든 경우, 혹은 낮잠을 잔 경우 등에 삼성헬스에 기록되는거 보면 먼저 잔 수면기록은 사라지고 나중에 기록된 수면만 남아있더라고요. 삼성헬스 앱에서 둘 다... ",삼성스마트폰-Z플립4/갤폴드4/갤럭시S...,https://cafe.naver.com/anycallusershow
첫 수면측정 후..,http://cafe.naver.com/facebot/181773,어제 액티브 수령 후 첫 수면체크를 했는데..흐 왜 이렇게 아침마다 힘든가 했더니 얕은 수면을 많이 하나봅니다ㅠㅠㅠ 오늘은 따뜻한 차라도 마시고 자야겠어요ㅠㅠ 푹 좀 자고싶습니다ㅠㅠ,갤럭시워치 커뮤니티 [갤럭시워치5 / ...,https://cafe.naver.com/facebot
애플워치 수면시간 측정 질문드립니다 ~,http://cafe.naver.com/appleiphone/6520040,애플워치3 구매하고 착용 후 자고 일어나서 확인해보니 수면시간 측정이 안되어있습니다. 혹시 수면시간 체크하려면 부가적으로 켜야하는 설정이 있을까요 ?,아사모 -[아이폰14 / Plus / Pro / Ma...,https://cafe.naver.com/appleiphone
혹시 워치 착용시 손목화상,http://cafe.naver.com/facebot/1145761,평소 일상이랑 수면측정 운동측정정도만 하는데 화상입어서 조금 당황스럽네요 그리고 추가질문인데 카톡실행시 2분정도 부팅시간이 걸리나요? 애플워치는 부팅시간없이 바로 켜지던데 워치4는 카톡실행시 좀 버벅이네요,갤럭시워치 커뮤니티 [갤럭시워치5 / ...,https://cafe.naver.com/facebot
갤럭시 핏e (수영시계. 일상시계. 수면측정시계) 택포3,http://cafe.naver.com/joonggonara/622564846,"개인거래(판매), 판매완료, 가격 30,000원, 직접결제, 갤럭시 핏e (수영시계. 일상시계. 수면측정시계) 택포3, 갤럭시 핏 e, 화이트 판매합니다~ 새상품입니다~ 사용 안할것같아서 올려요~",중고나라,https://cafe.naver.com/joonggonara
수면측정하는거 넘 답답하고 짜증나네요,http://cafe.naver.com/facebot/783123,사용기종 : 갤워치4 질문내용(구체적으로) : 워치4 산 뒤로 제대로 수면측정된 날이 없어요 일어나서보면 그냥 --시간--분 이렇게만나오고 제가 뭘 잘 못한건지 아니면 기계가 이상한건지 시계를 손목뼈 바로 아래쪽에... ,갤럭시워치 커뮤니티 [갤럭시워치5 / ...,https://cafe.naver.com/facebot
새제품)수면패턴 측정기 팝니다~~,http://cafe.naver.com/joonggonara/945588995,"개인거래(판매), 판매중, 가격 70,000원, 직접결제(네이버페이 송금), 새제품)수면패턴 측정기 팝니다~~, 중고나라에서 스타벅스&amp;GS25 드리는 거 아시나요? ...더보기 버튼을 눌러 확인해 주세요... ",중고나라,https://cafe.naver.com/joonggonara
수면 중에 착용 시 불편하신 분 없으신가요~?,http://cafe.naver.com/anycallusershow/3827086,"수면 측정 3일정도 했는데, 수면 분석이랑 코골이 측정도 다 잘됩니다 ㅎㅎ 단지, 잘 때 시계를 안차던 습관 때문에... 시계 차고 자면 쫌 불편하네요..ㅠ 1~2일 차엔 잠을 뒤척이면서 시계찬 팔이 조금 아픈거같고 무겁고... ",삼성스마트폰-Z플립4/갤폴드4/갤럭시S...,https://cafe.naver.com/anycallusershow
워치4 체험단 수면 아직 안되신분 있으신가요??,http://cafe.naver.com/anycallusershow/3843811,수면 측정돼서 완료한거로 알고있었는데 오늘 이벤트 가서 다시 확인해보니 30일에 했던 2차 미션이 안되어있더라고요..... 급한대로 낮잠 자고 했는데 수면측정이 안되네요 ㅠㅠㅠㅠ 이거 해결 가능한 방법 있을까요??,삼성스마트폰-Z플립4/갤폴드4/갤럭시S...,https://cafe.naver.com/anycallusershow
"워치의 수면측정 데이터, 휴대폰 동기화",http://cafe.naver.com/facebot/330623,"수면 분석 결과가 워치에는 나오는데, 블루투스 연결이 해지되어있던 탓에 휴대폰에는 수면 시간만 나오고 분석된 데이터는 나오지 않습니다. 휴대폰 삼성헬스 어플에서 워치가 등록이 되어 있음을 확인했고, 블루투스로... ",갤럭시워치 커뮤니티 [갤럭시워치5 / ...,https://cafe.naver.com/facebot
