title,link,description,cafename,cafeurl
워치4 코골이 기능 관련 질문드려봅니다.,http://cafe.naver.com/anycallusershow/3786355,저는 수면 측정 잘 되고 수면 시 혈중산소도 잘 측정되는데 코골이 측정이 데이터 없음으로 뜨네요. 제가 코를 안 골지는 않는데 뭔가 문제가 있어서 측정이 안되는 듯 한데... 일단 저는 충전케이블 연결상태로 머리옆에... ,삼성스마트폰-Z플립4/갤폴드4/갤럭시S...,https://cafe.naver.com/anycallusershow
처음으로 내 수면이 어떤지 확인..,http://cafe.naver.com/facebot/585556,갤3 구입하고 처음으로 수면측정 해 보았네요. 깊은잠은 못잤다고 나오는데..ㅠ.ㅠ 정학하진 않겠지만 어느정도의 데이터는비슷하리라 믿고 수면질을 높이도록 연구해 봐야 할 듯 합니다.. 나른한 오후에는 춘곤증이 오는... ,갤럭시워치 커뮤니티 [갤럭시워치5 / ...,https://cafe.naver.com/facebot
미밴드5 수면기록없음 문제 해결했어요,http://cafe.naver.com/xst/466507,"기종 :: 미밴드5 수면측정과 심박수를 체크하고자 구입한 미밴드5. 3만원대의 저렴한 가격에 중국의 실수라 불리는 이녀석이 일주일 넘게 수면기록이 측정이 되지 않아 속이 썩었지요. 결과적으로 방법은 하나, 폰을... ",샤오미스토리 - 가성비 유저 커뮤니티,https://cafe.naver.com/xst
샤오미의 상위버전 스마트워치에 대한 궁금증,http://cafe.naver.com/xst/564211,갤럭시핏2 쓰다가 갈아탔는데 수면측정이 월등히 잘되고 산소포화도도 측정되니 전보다 만족스럽습니다. 물론 앱의 편의성은 갤핏2가 더 좋았습니다. 사용중 갑자기 좀 궁금증이 생겨서 문의드리는데요. 샤오미의... ,샤오미스토리 - 가성비 유저 커뮤니티,https://cafe.naver.com/xst
GTS4 mini 일주일 사용 후기,http://cafe.naver.com/xst/568193,"수면 모니터링 설정 “켬”(수면호흡 질 측정은 아직은 베타라 끔) 으로 일주일 풀 착용으로 한 번도 충전하지 않고 확인한 배터리 상태입니다. “11%의 배터리 잔량울 확인할 수 있고, 좀 더 쥐어짜서 쓰면 8일정도 쓸... ",샤오미스토리 - 가성비 유저 커뮤니티,https://cafe.naver.com/xst
핏빗 수면측정 관련 질문입니다,http://cafe.naver.com/fitbituser/9092,"어느날은 점수도 뜨고 그래프도 디테일하게 알려주는데, 대부분 날들은 간단하게 요약만 나오네요,,, 매일 점수가 나오게 하는 방법은 없을까요?",Fitbit 핏비트 유저 커뮤니티,https://cafe.naver.com/fitbituser
워치5 오픈런미션 완로했습니다~,http://cafe.naver.com/facebot/1118710,워치4 44mm입니다. 수면측정이 오래걸렸네요 7일동안해야하니. ㅎ 근데 제휴미션은 원래 완료안뜨나봐요,갤럭시워치 커뮤니티 [갤럭시워치5 / ...,https://cafe.naver.com/facebot
기록용_스트라테라 10mg 2~4일차,http://cafe.naver.com/getampethskin/693298,"해보고싶어해서 수면 측정하려고 끼고 잠(수면시간 9시간, 깊은수면 58분) [12/10] 4 7시경 울면서 일어남 무서운 꿈(우리집이 거지가 되서 길에서 구걸하는 꿈)꿨다고 함 그런 일은 없다고 안아서 달래주고 죽 한 그릇... ",[거북맘vs토끼맘]아동심리/언어치료센...,https://cafe.naver.com/getampethskin
착용안했을때 배터리가,http://cafe.naver.com/anycallusershow/3820593,제목에는 간략한 질문내용 표시 사용기종 : 워치4 44mm 질문내용 : (구체적으로): 안녕하세요 평소엔 수면측정하느라 늘 워치를 착용하고잤었는데 오늘은 착용하지 않고잤습니다. 어제 90퍼센트까지 충전했었는데 오늘... ,삼성스마트폰-Z플립4/갤폴드4/갤럭시S...,https://cafe.naver.com/anycallusershow
워치는 실버,http://cafe.naver.com/hotellife/1665097,충전중인데 갑자기 삐리삐리 합니다 시계찾기해봤다네요 ㅎㅎ 시계좋아하는 남편이 스마트워치 저렇게 좋아할줄 몰랐네요 심지어 오늘 잘때 수면 측정 해본다네요 ㅎㅎ 워치 색상 고민하시는분계심 실버 추천합니다,[스사사] 스마트컨슈머들의 호텔/항공...,https://cafe.naver.com/hotellife
갤럭시 와치로 측정한 나의 수면,http://cafe.naver.com/knpa/10052,"저녁에 약을 (트라조돈,이펙사) 먹고 잠드는데 갤럭시 와치엔 ㄷㄷㄷ 깊은수면 0분 다른 분들은 어떤가요?... 피곤했거든요 수면트래킹하니 ㅋㅋㅋㅋ 수면 점수가 20~45점나오네요 이게 약을 먹어야 나오는 수면이라는게... ",한국 기면병 환우 협회,https://cafe.naver.com/knpa
애플워치 추천 부탁드려요,http://cafe.naver.com/appleiphone/6900034,"이번에 처음 아이폰 넘어가며 갤워치4 2개 팔았는데, 그걸로 애플워치 사려고 합니다 알림 확인 및 삭제, 간단한 답장, 수면 측정, 시간 확인(aod 필수...), 간단한 운동측정(lte는 없는거 gps는 폰이랑 같이 운동해서... ",아사모 -[아이폰14 / Plus / Pro / Ma...,https://cafe.naver.com/appleiphone
액티브2 베터리 실사용시간,http://cafe.naver.com/anycallusershow/3943310,외출 준비할때 배터리 공유로(5~10%만 충전되도) 4~5시간은 버티니까요! 제가 체감한 실사용 시간은 약 30시간 정도 버티네요 평상시 에도 운동측정이나 수면 측정할때 다음날 오후까지 유지되니 배터리는만족입니다,삼성스마트폰-Z플립4/갤폴드4/갤럭시S...,https://cafe.naver.com/anycallusershow
체중계까지 가민으로 바꾸니 편하네요ㅎㅎ,http://cafe.naver.com/finisherclub/47978,1.베뉴2로 수면 측정하고 동기화하고 MARQ 차고 나오면 MARQ에서는 수면측정값이 없다고 나옵니다. 어플에는 수면측정값이 나오구요 2. 베뉴2 MARQ 번갈아 차면 바디 배터리 수치가 튑니다. 예를 들어 베뉴2에서... ,피니셔클럽,https://cafe.naver.com/finisherclub
심박센서를 끄면,http://cafe.naver.com/finisherclub/59843,수면측정이 되나여?? 심박측정이 크게 필요없어서 평소때는 끄고 사용하려고하는데 수면추적은 너무 좋아서 그건 또 하고싶거든요 +_+,피니셔클럽,https://cafe.naver.com/finisherclub
미밴드5 렘수면 측정,http://cafe.naver.com/xst/442167,어제 미밴드5를 받아서 수면측정을 했는데 렘수면측정이 안되던데...ㅠ 혹시 왜 안되는지 아시는 분 알려주세요ㅠㅠ 미핏어플은 한글패치하면서 어제 업데이트 했습니다,샤오미스토리 - 가성비 유저 커뮤니티,https://cafe.naver.com/xst
워치 잘 때도 착용하시면 충전엔 언제 어떻게 하시나요?,http://cafe.naver.com/appleiphone/7080283,"워치 사용한지는 5년됐는데… 항상 퇴근 후 충전기에 올려두거든요. 수면측정, 아침알람, 단축어 등등 사용해보고 싶은데 잘 때도 착용하시는 분들은 언제 어떻게 충전하세요??",아사모 -[아이폰14 / Plus / Pro / Ma...,https://cafe.naver.com/appleiphone
혹시 영화볼 때 워치4 차보신 분 계신가요?,http://cafe.naver.com/facebot/734495,최근에 영화보고 나서 워치4 보니까 수면시간이 영화본 시간만큼 늘었더라구요 ㅋㅋㅋㅋㅋ 영화 인질 본거라 엄청 긴장한 상태였는데 수면 측정이 그냥 움직임만 감지해서 측정이 되나봐요,갤럭시워치 커뮤니티 [갤럭시워치5 / ...,https://cafe.naver.com/facebot
어메이즈핏 vs 미밴드7,http://cafe.naver.com/booksales/1160366,갑자기 손목이 허전해보여서 지르고 싶어요 그냥 시계기능 만보기기능 수면측정 알림 정도 사용할거같고 배터리 짧은건 싫어서 둘중에 고민하려고 해요 미밴드 쓰자니 신랑이 너무 학생같다고 반대하는데 전 디자인은... ,● 책자람(책과 함께 자라는 아이들과...,https://cafe.naver.com/booksales
비보스마트 5 성능 결과,http://cafe.naver.com/finisherclub/55887,웨이트 정확도 사이클 정확도 정확도 순위 수면측정 정확도,피니셔클럽,https://cafe.naver.com/finisherclub
피닉스6X사파이어 유저님들....,http://cafe.naver.com/finisherclub/48067,수면측정 이 안되고 있어서 도움 요청 드립니다 운동량측정 모두 ON 되여 있고 심박은 OFF 이상태에서 수면 측정이 되는지요 포르너 645는 이상태에서도 측정 되는데 피닉스6X는 일주일을 착용하고 자 봐도 측정이... ,피니셔클럽,https://cafe.naver.com/finisherclub
9월19일(월) 수면기록 올려 봅니다.,http://cafe.naver.com/facebot/1132491,넘 피곤함....ㅠㅠ,갤럭시워치 커뮤니티 [갤럭시워치5 / ...,https://cafe.naver.com/facebot
45일 사용?GTR2e 간단 리뷰,http://cafe.naver.com/xst/511875,"일단 막써보는 기준으로 수면측정 하게 되면 1일에 24% 수면시 착용하지 않는다면 1일에 15%정도 닳는것 같습니다. (하루 30~1시간 운동 측정 GPS 사용 포함) 즉 풀 사용시 4일, 수면 미착용시 7일, AOD 끄고 사용하면 약... ",샤오미스토리 - 가성비 유저 커뮤니티,https://cafe.naver.com/xst
수면클리닉 가야만 수면패턴측정이 가능한가요?,http://cafe.naver.com/tripworldwater/3895,잠이 너무 안오기도 하고 수면패턴측정 좀 해서 규칙적으로 잠을 자고 싶어서요. 워낙 야근도 많고 갑자기 새벽 출근도 해야되고 그럴때가 있어서 잠을 불규칙하게 잤더니 요즘 잠이 잘 안들어요...수면패턴측정 좀 해보고... ,불면증/수면장애/우울증/수면제/숙면/...,https://cafe.naver.com/tripworldwater
어제 미워치 쿠팡발로 와서 착용해봤는데 괜춘하긴 하네요,http://cafe.naver.com/xst/523554,운동용으로 하나 질렀는데 입문용으로는 괜찮은 거 같습니다 다만 수면측정도 할려고 착용하고 잤는데 수면측정은 안되네요:: 무슨 문제인지 모르겠는데 꼭 필요한 건 아니라 그냥 쓸려고 합니다,샤오미스토리 - 가성비 유저 커뮤니티,https://cafe.naver.com/xst
수면점수 인증,http://cafe.naver.com/facebot/421286,어제 워치 받은 후 가장 궁금했던 수면시간 측정했습니다. 점수가 너무 낮고 깊은 수면이 없어 충격 ㅠㅠ,갤럭시워치 커뮤니티 [갤럭시워치5 / ...,https://cafe.naver.com/facebot
[Zepp app]v6.3.1 업뎃...문자알림(내용표시 O),http://cafe.naver.com/xst/527425,2021.09.03 - 심박수 센서 먹통 - 근접 센서 먹통 - 재부팅 3회 - 연결끊기 하고 재연결후 복구됨 - PAI 기능 의심 2021.09.13 - 수면측정 않됨 - PAI 기능 이상으로 추측함 2021.09.14 - 수면측정 않됨 - 재부팅 2회... ,샤오미스토리 - 가성비 유저 커뮤니티,https://cafe.naver.com/xst
배터리 때문에 고민 되네요~ㅜㅜ,http://cafe.naver.com/facebot/849240,"사용기종 : 갤럭시워치4 -수면측정 : 야간에 심하면 약20% 정도 소모 -운동자동측정 : 이것 켜니까 배터리 광탈 합니다. 6시간에 거의 20% 소모 저 두가지를 추가 사용 중인데, 끌까말까 고민 중 입니다 ㅜㅜ 워치4... ",갤럭시워치 커뮤니티 [갤럭시워치5 / ...,https://cafe.naver.com/facebot
애플워치 차다가 미밴드6갈아타니......,http://cafe.naver.com/appleiphone/7140538,충전의 압박에서 벗어나서 좋네요 최소한 완충하면 열흘 이상은 가네요 미밴드6로도 폰 알림 다 받고 음악콘트롤도 되고 사진촬영도.되고 수면측정. 심박수 등 어지간한건 다 되네요 쓰던 애플워치는 아내에게... ,아사모 -[아이폰14 / Plus / Pro / Ma...,https://cafe.naver.com/appleiphone
미밴드4 수면시간 정확한가요?,http://cafe.naver.com/xst/375415,미밴드4의수면시간이 정확한가요? 정확하다면 무슨 원리인지 알수있을까요?,샤오미스토리 - 가성비 유저 커뮤니티,https://cafe.naver.com/xst
애플워치 전원 꺼놓으면 + 고민,http://cafe.naver.com/appleiphone/7125466,"꺼놓을지 팔지 고민이라니까 팔꺼면 자기가 내일 당장 산다고 .. 현재 애플워치 용도 : 비싼 시계 ㅋㅋㅋㅋㅋ, 계산기, 라면 타이머, 잠잘 때 수면 측정 이거든요 막상 팔려니 또 나중에 사고싶어질까봐 ^^... 꺼논다 vs 판다",아사모 -[아이폰14 / Plus / Pro / Ma...,https://cafe.naver.com/appleiphone
[AI 하틴루] 헬스케어 솔루션#잠이보약이다# 가족의안부#나의안부챙겨요,http://cafe.naver.com/remonterrace/28721860,"편리, 수면 측정에 용이하다고 해요 이런 특징을 바탕으로 스마트 홀몸어르신 돌봄서비스 시범사업에 활용되기도 했다는데요 카메라나 녹음 장치가 없어 사생활은 철저하게 보호하면서 건강 체크까지 침실에 설치만... ","레몬테라스 [인테리어,리폼,DIY,요리,...",https://cafe.naver.com/remonterrace
수면 중 혈중산소,http://cafe.naver.com/lovefaithjkc/487348,매일 수면 혈중산소 90프로 미만 길게는 15분? 이정도인데요 병원진단 받아봐야할까요? * 글 작성시 카페정책과 규정 준수 * * 모임 만남 카톡 채팅 및 각종 소개글(유튜브 SNS 병원 중고판매 명상 대체요법 타교회소개... ,공황장애 완치,https://cafe.naver.com/lovefaithjkc
수면체크는 터치하여 결과 확인하기인가 눌러야만 측정이 종료되나요,http://cafe.naver.com/facebot/1040148,질문내용(구체적으로) : 수면체크는 터치하여 결과 확인하기인가 눌러야만 측정이 종료되나요? 자고 일어나서 몸 안 일으킨채로 휴대폰하면 계속 수면중 깬 상태로 측정되네여... 완전 종료하려면 터치하는수밖에 없나용,갤럭시워치 커뮤니티 [갤럭시워치5 / ...,https://cafe.naver.com/facebot
수면기록,http://cafe.naver.com/facebot/1132181,사용기종 : 위치5 질문내용(구체적으로) : 수면기록보면 램수면 얕은수면 깊은수면이 있던데 센서가 정확한가요? 어떻게 측정을 하죠?,갤럭시워치 커뮤니티 [갤럭시워치5 / ...,https://cafe.naver.com/facebot
심박수측정,http://cafe.naver.com/happy88car/155924,들어올때가 있습니다 그래서 아무리 설정을 봐도 들어올만한건 못찾겠는데 혹시 제가 놓친부분이 있는지 답변 부탁드립니다 심박수 측정 수동으로했고 수면측정 꺼놓고 운동알림도 꺼놓고 스트레스 측정도 다꺼놨습니다,[스사노]스마트워치 사용자 노리터[타...,https://cafe.naver.com/happy88car
전화 수신시에 통화 화면이 안 켜집니다.,http://cafe.naver.com/develoid/980222,잠금화면을 사용하는 앱(ex.캐시슬라이드)이 있으면 이런다고 하는데 수면 측정앱 Sleep을 새벽 제외하고는 사용하지도 않아요. 그리고 그 전에는 sleep이 켜져있는 상태에서도 잘 작동 했구요. 방해금지모드는 기상 후... ,디벨로이드 [ IT 테크 커뮤니티 ],https://cafe.naver.com/develoid
워치4 수면측정요,http://cafe.naver.com/facebot/721383,워치를 차고있는사람 코골이가 녹음되는건가요?? 아님 옆에자는사람 코골이도 녹음될수있나요?? 궁금해지네요..ㅎㅎ,갤럭시워치 커뮤니티 [갤럭시워치5 / ...,https://cafe.naver.com/facebot
워치 4 최초 체험단 미션 에러 뜬 사람 계신가요?,http://cafe.naver.com/anycallusershow/3882257,"확실히 다 찍힌 거 보고 기다렸는데 방금 확인해 보니 수면측정, 걸음수 측정에서 실패해서 해피콘, 스트랩100원 쿠폰은 안 준다네요. 이런 분들 계신가요? 체험 다 하고 걸음수 10번 수면 2번 기간에 맞춰서 다 하고... ",삼성스마트폰-Z플립4/갤폴드4/갤럭시S...,https://cafe.naver.com/anycallusershow
[체험단] Amazfit Bip U 실사용 후기 [2],http://cafe.naver.com/xst/480714,"알림받을 앱 설정 및 워치에서의 삭제 AMAZFIT Bip U에는 수면측정 및 분석, 스트레스 측정, 혈중산소포화도 기능이 포항되어 있습니다. 항상 측정으로 해놓아서 편했습니다. 수면측정 / 심박수 측정 / 혈중 산소포화도... ",샤오미스토리 - 가성비 유저 커뮤니티,https://cafe.naver.com/xst
샤오미 미밴드6,http://cafe.naver.com/joonggonara/925746965,더보기 버튼을 눌러 확인해 주세요 ---------------------------------------------- 샤어미 미밴드6 입니다 일주일정도 수면측정 쓰다가 보관만 하다가 판매해요 덕분에 상태는 최상입니다 풀박스 모든 구성품 미아사거리 부근... ,중고나라,https://cafe.naver.com/joonggonara
워치 수면 코골이기능 에 대해 질문드립니다,http://cafe.naver.com/facebot/1130580,사용기종 : 워치4 클래식 46 질문내용(구체적으로) : 워치 수면 중 코골이 측정하려면 핸드폰이 충전 중 인 상태여야 하잖아요? 근데 핸드폰 배터리 100프로임에도 계속 충전기에 꼽아두면 수명깎인다고들어서... ,갤럭시워치 커뮤니티 [갤럭시워치5 / ...,https://cafe.naver.com/facebot
워치5프로 오픈런 오늘 해보니 되네요,http://cafe.naver.com/facebot/1115334,GPX가 계속 안되더니 오늘 수면측정이 안되는 김에 삼성헬스 지웠다 깔고 GPX 미션 진행하니 완료되네요!!,갤럭시워치 커뮤니티 [갤럭시워치5 / ...,https://cafe.naver.com/facebot
원래 gts2 mini 배터리 이렇게 짧나요?,http://cafe.naver.com/xst/514440,"AOD 16시간 정도 켜놓고, 심박수 10분마다 측정, 손목 들면 켜지기 켜놓고, 수면 측정 이정도만 사용하고 있는데 최대 2주는 무슨 3-4일에 한 번 꼴로 충전하고 있어요.. 원래 이렇게 짧은 건가요??",샤오미스토리 - 가성비 유저 커뮤니티,https://cafe.naver.com/xst
[체험단] Amazfit Band5 사용 후기(2편),http://cafe.naver.com/xst/461981,"정확한 수면 측정에 만족스러웠으며 좀 더 넓어진 디스플레이, 다양한 운동 측정이 좋았습니다 또한 저는 워치페이스를 기본으로 사용하고 있지만 미밴드5의 워치페이스를 그대로 사용할수 있는 장점도 있습니다!!!... ",샤오미스토리 - 가성비 유저 커뮤니티,https://cafe.naver.com/xst
워치4로 수면측정해보고 수면에 문제잇는지알은거같아요 ㅋㅋ,http://cafe.naver.com/anycallusershow/3796492,평소에 꿈마니꿔서 깊은잠은아니다 라는 소리는 많이들엇는데 32점 ㅠㅠ,삼성스마트폰-Z플립4/갤폴드4/갤럭시S...,https://cafe.naver.com/anycallusershow
배터리가 너무 빨리 닳아요,http://cafe.naver.com/facebot/722779,워치4 40mm 쓰는데 수면측정 하고싶어서 완충해서 차고 일어나니 45%밖에 안남아있어요ㅡㅡ;;; 다시 완충해서 오전 11시쯤에 차도 7시 넘으니 20%대 밖에 안남아있더라구요 원래 이렇게 한나절도 다 못쓰는건가요?... ,갤럭시워치 커뮤니티 [갤럭시워치5 / ...,https://cafe.naver.com/facebot
워치 기능 중에 어떤걸 많이들 쓰시나요,http://cafe.naver.com/facebot/727734,인바디 측정기능은 괜히 기분 나빠져서 잘 안하게 되고 ㅎㅎ 저는 운동량 자동측정 되는 기능이랑 스트레스 측정 기능이 좋더라구요. 수면측정 기능도 써보고 싶은데 다음날 출근전 배터리 충전해서 쓸 기회가 없네요 ^^;;,갤럭시워치 커뮤니티 [갤럭시워치5 / ...,https://cafe.naver.com/facebot
수면 단계 측정이 잘 안되는건 왜 그런걸까요,http://cafe.naver.com/anycallusershow/3870220,헐렁하게 차지도 않았는데 말이죠,삼성스마트폰-Z플립4/갤폴드4/갤럭시S...,https://cafe.naver.com/anycallusershow
애플워치 심박수 측정 믿을만 한가요?,http://cafe.naver.com/appleiphone/7540298,"애플워치 8 이번에 새로 구매하여 수면시에 착용하는데, 수면 시 심박수가 낮은 건 알고 있었지만 일어나서 확인해보니 저심박수 알람이 많이 와있었어요.. 평균적으로 38-40 사이던데 믿을만한거지 병원을... ",아사모 -[아이폰14 / Plus / Pro / Ma...,https://cafe.naver.com/appleiphone
초응파센서의측정각도를 좁히려면 어찌해야할까요?,http://cafe.naver.com/arduinostory/113705,15센치이하로내려가면 벽면을 측정하게되는건지 수면은 실제내려가는데 수치는 동일하게나오네요 딱 이센서로 보다좁은각도로 딱 직선으로만 해당하는 각도의 물체를 감지하려면 어떻게 해야할까요?,아두이노 스토리,https://cafe.naver.com/arduinostory
수면측정하다보니 심하긴하네요,http://cafe.naver.com/facebot/782399,이정도로 자다가 많이 깨고 푹못자는줄은 처음 알았습니다...,갤럭시워치 커뮤니티 [갤럭시워치5 / ...,https://cafe.naver.com/facebot
[연구참여자모집] 수면애플리케이션 연구참여자(3-12개월 아기)모집합니다.,http://cafe.naver.com/happymom7979/1218962,"앱사용 4주, 자료수집 3주(3회 각 10-15분 방문이 있으며, 방문하여 설문지, 수면측정기기를 배부드리며, 5일동안 수면기기를 착용하게 됩니다)에 성실히 참여해주실 맘님들의 참여 부탁드립니다. 궁금하신 부분있으면... ",[ 해피타운 ] (구)happy안양군포의왕맘...,https://cafe.naver.com/happymom7979
애플워치 울트라 온도측정 어디서 보나요?,http://cafe.naver.com/appleiphone/7571074,아무리 찾아봐도 안나오네요 ㅜㅜ,아사모 -[아이폰14 / Plus / Pro / Ma...,https://cafe.naver.com/appleiphone
[체험단] 어메이즈핏 밴드5 3주간 사용후기,http://cafe.naver.com/xst/461822,때문에 수면 시 심박수와 산소포화도를 같이 모니터링하여 보다 정확한 수면 측정과 호흡의 질을 측정을 해줘 좀 더 다양한 수면상태를 측정할 수 있습니다. (수면 시 산소포화도 측정은 별도로 설정을 해줘야 합니다.)... ,샤오미스토리 - 가성비 유저 커뮤니티,https://cafe.naver.com/xst
나의 수면 도우미~비보스마트5,http://cafe.naver.com/finisherclub/57677,카페 이벤트로 받은 가민비보스마트5 수면 시 착용하고 자고 있는데 편하고 좋네요. 택틱스 델타는 수면 시 살짝 불편하고 가끔 잠결에 와이프 툭 치면 놀라곤 했는데 비보스마트5는 차고 자는지도 모르겠네요.~^^ 요놈이... ,피니셔클럽,https://cafe.naver.com/finisherclub
수면시 다들 끼고 주무시나요?,http://cafe.naver.com/facebot/918128,초반에는 계속 끼고 잤는데 이게 은근 쫌 답답한 면도 있네요ㅜㅜ 코골이 말고는 꼭 끼고 자야 되는 기능들이 있나요?,갤럭시워치 커뮤니티 [갤럭시워치5 / ...,https://cafe.naver.com/facebot
깊은잠을 못자는것도 불면증일까요.?,http://cafe.naver.com/honeymoondc/928282,중간에 깨는것도 그렇고 워치로 수면측정하면 깊은수면 거의안나오네요 자도 자도 덜잔것같고ㅜㅜ 이럴때 추천받을만한 영양제나 음식 있을까요,&lt;신행싸 & 웨딩싸&gt;-신혼여행 결혼준비...,https://cafe.naver.com/honeymoondc
애플워치보다 갤워치가 좋은 거,http://cafe.naver.com/anycallusershow/3905312,질문/추천 금지 X 갤워치로 넘어오면서 좋은 건 수면측정 신기 인바디 신기하고 워치로 노래 듣는 거 신기하네여 부드러운 Ui는 애플워치가 부럽다는..,삼성스마트폰-Z플립4/갤폴드4/갤럭시S...,https://cafe.naver.com/anycallusershow
갤워치4 사용 1주일 정도 후기,http://cafe.naver.com/facebot/721138,"여러 기능 중 수면측정이 가장 좋았어요 수면패턴부터 깊은 수면까지 알 수 있는게 좋았고, 특히 코골이 부분이 제일 좋았네요. 코 거의 안고는 편인데 생각보다 그르르 거리는게 많아서 신기하기도 했어요",갤럭시워치 커뮤니티 [갤럭시워치5 / ...,https://cafe.naver.com/facebot
ios 15.4 페이스ID 마스크 인식,http://cafe.naver.com/appleiphone/7165082,"너무 좋내요. 수면 측정 및 베터리 지속시간, 거의 항상 착용하려고 착용감이 좀 중요해서 애플워치가 아닌 핏빗차지5 했는데 마스크 쓰고 페이스ID 안되는게 제일 아쉬웠는데. . 해결이 되니 너무 좋군요 ㅎ",아사모 -[아이폰14 / Plus / Pro / Ma...,https://cafe.naver.com/appleiphone
워치7 배터리 다들 어떠신가요!,http://cafe.naver.com/appleiphone/6994176,그리구 예전에 워치4 한창 쓸 때도 배터리가 부족해서 불편했던 적은 없었거든요 (잘 때 수면측정 하시는분들은 불편하실 것 같네요 ㅠㅠ) 다른분들은 워치7 배터리 지속시간 어떠신가요~? 문득 궁금하네용 ㅎㅎㅎ,아사모 -[아이폰14 / Plus / Pro / Ma...,https://cafe.naver.com/appleiphone
워치4 밤 도중에 빨간불,http://cafe.naver.com/facebot/745195,사진처럼 계속 워치착용중인데도 손목닿는부분에 빨간불이 새벽에 들어와서 서비스 센터 갔는데 수면측정or코골이측정때문에 그런 거라네요! 인터넷에 검색해도 안나와서 엄청 당황했었는데 다른 분들은 저처럼 헛걸음... ,갤럭시워치 커뮤니티 [갤럭시워치5 / ...,https://cafe.naver.com/facebot
