title,link,description,cafename,cafeurl
수면체크 이거 애매하네요.,http://cafe.naver.com/facebot/735238,"퇴근하고 나서 바로 자야 할때, 수면체크를 하기 위해서는 시계를 차고 있어야 하는데, 중요한것은 충전도 해야한다는거... 충전하자니 수면체크를 못하고, 수면체크 하자니 충전이 어렵고.. ㅡ,.ㅡ;;; 차 거치에 무선... ",갤럭시워치 커뮤니티 [갤럭시워치5 / ...,https://cafe.naver.com/facebot
수면패턴 질문,http://cafe.naver.com/facebot/972497,사용기종 : 갤럭시워치 4 질문내용(구체적으로) : 수면패턴 측정이 있는걸로 알고있습니다!! 저는 잘 땐 불편해서 시계를 안차고 자는데 혹시 다른 방법은 없을까요?? 기능적으로 활용한번 해보고 싶어서요,갤럭시워치 커뮤니티 [갤럭시워치5 / ...,https://cafe.naver.com/facebot
[모집중] 수면연구 참여자를 모집합니다 (수면앱)^^ (3-12개월 아기와 어머니),http://cafe.naver.com/imsanbu/51371959,"1) 수면증진 모바일 어플리케이션을 4주 동안 사용(앱 사용 일정은 연구일정에 따름) 2) 자료수집 (3회) ① 아기와 어머니는 5일 동안 수면측정기기를 착용하고, 수면일지를 기록하게 됩니다. ② 수면측정기기 배부... ",맘스홀릭 베이비 (300만 엄마들의 임신...,https://cafe.naver.com/imsanbu
수면 패턴 측정해봤어요,http://cafe.naver.com/srdental/7320,"수면 패턴 측정하는 앱이 있길래 한번 사서 잘 때 옆에 두고 잤더니 깊은 잠, 얕은 잠 측정이 되더라구요 엄청 정확한 건 아니겠지만 제가 평소에 잘때 숙면한다고 느껴서 정말일까 싶어서 해봤는데 정말 잘... ",♥사람사랑치과 공식카페♥,https://cafe.naver.com/srdental
수면측정은 수면모드켜야만 기록되나요?,http://cafe.naver.com/appleiphone/6067424,아니면 애플워치 끼고 자기만 해도 수면기록이 되나요?,아사모 -[아이폰14 / Plus / Pro / Ma...,https://cafe.naver.com/appleiphone
수면측정 꽤 괜찮네요,http://cafe.naver.com/finisherclub/12865,완벽하진 않지만 비슷한거 같네요 움직임으로 판단하는거 같은데 심박수로도 판단하려나요?,피니셔클럽,https://cafe.naver.com/finisherclub
수면모드에 대해서,http://cafe.naver.com/appleiphone/7036140,1) 일찍 일어나서 수면모드를 해제해도 수면/기상 알람은 정해놓은 시간에 울리는건가요? 2) 위와 같은 경우 수면 기록 측정(애플워치 차고 있는 상태) 은 수면모드를 해제한 시점까지 기록되나요?,아사모 -[아이폰14 / Plus / Pro / Ma...,https://cafe.naver.com/appleiphone
수면측정 오늘도 해봤지만 너무 신기해요..!,http://cafe.naver.com/facebot/708389,오늘은 그래도 어제 41점에서 56점으로 상승했네요..! 다만 코를 골아서 살짝 현타가 왔지만...ㅎㅎㅎ 제 코고는 소리 처음 들어보니까 디게 신기하더라구요 어떤 방식으로 딱 맞춰서 녹음을 하는지도 혹시 아시는 분... ,갤럭시워치 커뮤니티 [갤럭시워치5 / ...,https://cafe.naver.com/facebot
애플워치 질문좀요,http://cafe.naver.com/appleiphone/7466109,잠잘때 수면측정은 안해도 꼭 차고 잡니다. ... 여기서 와이파이 를 켜두어야할 필요가 있을까요? 애플워치에서 인터넷을 하는 것도 아니고... 애플워치에 와이파이 활성화 시켜야 할 이유가 뭔가요?,아사모 -[아이폰14 / Plus / Pro / Ma...,https://cafe.naver.com/appleiphone
혹시 다들 주무실때 수면모드로 해서 차고 주무시나요? ㅎㅎ,http://cafe.naver.com/facebot/945195,사용기종 : 갤럭시워치4 저는 사용한지 얼마 안돼서 넘 신기한 마음에 자기전까지 충전해두고 잘때도 끼고 자거든요 ㅋㅋ 수면패턴 체크해주는것도 신기하고 코골이를 녹음한다는데 그것도 궁금하고... 다들 어떻게... ,갤럭시워치 커뮤니티 [갤럭시워치5 / ...,https://cafe.naver.com/facebot
모토360으로 수면측정 해봤습니다,http://cafe.naver.com/google4u/8619,최근 모토360 등 스마트워치등을 대거 지원하게 됐길래 한번 사용해봤습니다. 6시간 반동안 수면측정하는데 배터리는 25%밖에 안달더라고요. 생각보다 안달아서 놀랐네요.,웨어러블스 -홀로렌즈 스마트워치 LG워...,https://cafe.naver.com/google4u
갤럭시 워치 수면측정 해봤습니다,http://cafe.naver.com/dieselmania/35729531,이래서 자고일어나도 피곤했던건가..,●디젤매니아● 대한민국 일등 패션 커...,https://cafe.naver.com/dieselmania
워치4 누워있으면 다 수면으로 잡히는거같은데,http://cafe.naver.com/anycallusershow/3859265,잔걸로 수면이 측정됐어요 분명 누워서 움직이기도했고 폰도 만지고 카톡도 보내고 했는데 잠들기 전에 누워서 넷플보던 시간이 또 수면으로 측정되더라고요 그냥 누워있으면 수면으로 잡는거 같은데 이게 제 워치... ,삼성스마트폰-Z플립4/갤폴드4/갤럭시S...,https://cafe.naver.com/anycallusershow
R80 * 3 대 PAR 측정값 공유,http://cafe.naver.com/seaaes/733532,"측정값 조명 3개 ON, 가장 상단의 측정값은 수면위 측정값임 6. 결과 - 아크릴 2T 이상의 광확산판 사용으로 인해 광량 소실이 20~30% 가량 발생되었을 것으로 예상됨. 그로 인해 조명의 강도는 비확산판 사용시... ",리프패밀리(해수어 산호),https://cafe.naver.com/seaaes
와이프한테 와치4 클래식을 선물로 받았어요,http://cafe.naver.com/facebot/1148141,와이프한테 생일선물로 받았어요 손목시계인데 딸내미 얼굴에 시간 나오게 만들 수 있는 것도 신기하고 밤에 차고 자면 수면 질 측정해주는 것도 신기하고 근데 그 이후로 활용법을 잘 못 찾고 있어요 그냥 시계로...... ,갤럭시워치 커뮤니티 [갤럭시워치5 / ...,https://cafe.naver.com/facebot
워크온 수면 시간 측정 오류!!,http://cafe.naver.com/icaresens/70818,수면 시간 측정 오류!! 14시간? 12시간? - 오류 ; 개선 필요 합니다. 여러분은 어떠신가요?? 오늘!! 어제!!,"당뇨인의 쉼터, 아이러브케어센스(케사...",https://cafe.naver.com/icaresens
수면분석 프로그램요?,http://cafe.naver.com/appleiphone/4122912,안녕하세요. 애플워치 수면분석 수면 측정 어플이 뭐가 있을까요? 추천 좀 부탁 드려요. 요즘 잠을 잘 못 자요. ^^ 즐~한가위 보내세요.,아사모 -[아이폰14 / Plus / Pro / Ma...,https://cafe.naver.com/appleiphone
수면 인증,http://cafe.naver.com/facebot/900382,수면 기록이 정확한지 의문이네요. 가만히 있으면 수면으로 측정되고 거기에 깊은 수면까지 했다고 나오는데... 신체 움직임으로 감지 하나봐요,갤럭시워치 커뮤니티 [갤럭시워치5 / ...,https://cafe.naver.com/facebot
비보스마트5 좋네요 ㅎㅎ,http://cafe.naver.com/finisherclub/57022,피닉스6x 데일리로 착용하고 집에와서 수면측정 및 아침 알람때문에 비보스마트5 구입해서 착용했는데 가볍고 좋군요 ㅎㅎ 운동용으로는 좀 부족한 듯 싶지만 그냥 이렇게 모니터링으로 쓰기엔 좋네요. 단점은... ,피니셔클럽,https://cafe.naver.com/finisherclub
수면시간 측정하시는 분 계신가요,http://cafe.naver.com/finisherclub/20133,요즘 수면 체크하려고 잘 때 시계 착용하고 자는데요 생각보다 깊게 잠드는 시간이 적더라구요 많으면 1시간 반 적으면 30분 정도? 어제는 아예 없다고 나오던데 수면 체크 정확한 편인가요? 나름 꿀잠잤다고 생각했는데... ,피니셔클럽,https://cafe.naver.com/finisherclub
수면중 산소포화도 측정 계속 해주는 제품 있나요?,http://cafe.naver.com/xst/466488,샤오미 밴드나 시계 시리즈중에 수면중에 주기적으로 산소포화도 측정 계속 해주는 제품 혹시 있나요 시간대별로 그래프같은걸로 볼 수 있게 말에요 잠깐 버튼 눌러서 그때 그때 한번 측정하는거 말구... 어메이즈밴드5 나... ,샤오미스토리 - 가성비 유저 커뮤니티,https://cafe.naver.com/xst
"워치4오늘샀는데 , 그냥 아무설정없이 자고일어나면 수면측정되있나요?",http://cafe.naver.com/facebot/749501,사용기종 : 워치4 질문내용(구체적으로) : 그냥 자면 아침에 수면 점수같은거 볼수있는건가요? 지금은 ㅡㅡ시 ㅡㅡ분 이렇게되있어요,갤럭시워치 커뮤니티 [갤럭시워치5 / ...,https://cafe.naver.com/facebot
가민 수면체크 변동하네요,http://cafe.naver.com/finisherclub/46326,저번에도 일어나서 확인한 수면체크와 오후에 확인하니 데이타가 변경되어 있더군요 오늘도 한시간 후 가민어플 들어가니 또 변경되었네요 깊은잠 시간이랑 구간도 변경 rem도 추가되었구요 계속 활동했는데 변경되는... ,피니셔클럽,https://cafe.naver.com/finisherclub
미밴드 건강관련 위주로 사용 할건데요!!,http://cafe.naver.com/xst/560005,혹시 미밴드 그간 쓰셨던 분들중에 유용하게 사용하는 기능이 있을까요?? 하루 몇시간 자는지 궁금해서 수면측정 기능 하나만 보고 사긴 했습니다만.ㅋㅋㅋㅋ 아참 그리고 pai? 라고 있는 아이콘의 용도는 무엇인가요??,샤오미스토리 - 가성비 유저 커뮤니티,https://cafe.naver.com/xst
애플워치 수면앱 관련 문의,http://cafe.naver.com/appleiphone/6057285,수면앱 측정하려면 시계 차고 자야되나요? 설마 시계차고 자는 사람이 없는데 벗고 자도 측정이 되나요?,아사모 -[아이폰14 / Plus / Pro / Ma...,https://cafe.naver.com/appleiphone
수면호흡측정 시스템 &quot;빗밴드&quot; 체험단 모집중이래요^^,http://cafe.naver.com/1msanbu/2618896,"수면호흡측정시스템 '빗밴드'는 수면 중 호흡상태를 측정해 핸드폰으로 관리할 수 있게 도와주는 제품이에요. 자는 동안 내 수면 습관 상태를 꼼꼼히 15초 간격으로 체크해주니 기상 후 코골이, 무호흡, 몸뒤척임 상태를... ","지후맘-임신, 출산, 육아정보, 체험단...",https://cafe.naver.com/1msanbu
애플워치 수면어플 어떤거 쓰시나요?,http://cafe.naver.com/appleiphone/5047604,애플워치 수면 측정 어플 다들 어떤거 쓰시나요~?,아사모 -[아이폰14 / Plus / Pro / Ma...,https://cafe.naver.com/appleiphone
수면장애인분들 계신가요?,http://cafe.naver.com/yeongjongdolove/776961,잠을 푹 못자는것같아요~ ㅜㅜ 수면유도제를 먹어야하나 싶을정도에요 그리고 꿈도 너무많이꿔요 주변말 들어보니 꿈많이꾸는것도 깊게 못자는거라면서요?? 근데 전 어릴때부터 꿈을 엄청꿨는데말이죠...,영맘 : 영종 국제도시 엄마들의 모임 ...,https://cafe.naver.com/yeongjongdolove
수면기록 인증,http://cafe.naver.com/facebot/995657,활용이 늘어나면서 확실히 건강에 대한 관심도 늘어나네요. 카페 활동도 도움이 되구요. 처음으로 수면기록 측정도 해보았습니다. 보통 렘 수면 단계에서 꿈을 꾼다는데 기억은 없네요. 회원분들 모두 편안한 밤 보내세요~,갤럭시워치 커뮤니티 [갤럭시워치5 / ...,https://cafe.naver.com/facebot
미밴드6vs7,http://cafe.naver.com/xst/567271,"밴드를 처음구매해보려는데요 수면측정이랑 원격카메라 촬영(7은 갤럭시는 안된다고 알고 있는데 수면측정이 우선이라 더 좋다면 상관없습니다) ,(간혹 운동) 이기능 때문에 사려고 하는데 어떤게 더 나을까요? 잠잘때... ",샤오미스토리 - 가성비 유저 커뮤니티,https://cafe.naver.com/xst
적당한 스마트워치 찾고 있습니다. gtr2e 생각중인데 어떤지 봐주세요.,http://cafe.naver.com/xst/555857,"aod,걸음측정,수면측정,전화알림,문자알림,시계,긴 배터리타임 필요합니다. gtr2e 생각중인데 적당할까요. 여자손목인데 좀 클까요. 손목둘레 15.5 미밴드6 사용하다가 아이한테 주고 gts2mini 샀는데 아이가 밴드... ",샤오미스토리 - 가성비 유저 커뮤니티,https://cafe.naver.com/xst
심박수좀 봐주세요... 이거 측정 잘못된건가요??,http://cafe.naver.com/leeheartwell/73620,원래 50-80 왔다갔다 하고있어요 잘못 측정된거죠?? 수면이랑 산소포화도는 점선없이 잘 측정되었길래 여쭤봅니다.. 참고로 중증심부전으로 ef30% 약 복용중인 20대입니다! 어제부터 어지럽고 머리가 아프긴해서... ,심혈관정보커뮤니티(심혈관질환/협심증...,https://cafe.naver.com/leeheartwell
워치 수면시간 측정,http://cafe.naver.com/anycallusershow/2723679,에 두고 잣는데 자고일어나니까 1시부터 8시40분까지 수면시간 체크했다고 뜨더라구요?? 사용한적 없는데 수면시간 체크되서 조금 소름이였어요.. 심지어 실제로 잔 시간도 비슷.. 왜이럴까요? 자주질문 정리글 바로가기,삼성스마트폰-Z플립4/갤폴드4/갤럭시S...,https://cafe.naver.com/anycallusershow
낮잠잘때는 수면측정 가능한가요?,http://cafe.naver.com/finisherclub/61982,"수면셋팅시간은 10시30분~익일06시로 셋팅되어있는데, 예를 들어 점심 오후1시부터3시까지 낮잠을 자게된다면 낮잠수면측정은 수동으로 가능한가요? 사진에서보는거와같이 수면모드켜기눌르고자고, 일어나서... ",피니셔클럽,https://cafe.naver.com/finisherclub
샤오미미밴드로 수면측정할때요,http://cafe.naver.com/cosmania/32698872,폰이랑 샤오미미밴드랑 연동은 했는데 밤에 잘때 블루투스를 꺼놓고 자도 측정이 되나요? 아님 블루투스를 꼭 켜고 자면서 측정이 되나요??,카페 파우더룸 [ 화장품.뷰티.쇼핑.일...,https://cafe.naver.com/cosmania
미밴드5 수면표시 오류,http://cafe.naver.com/xst/490448,껐다켜봐도 안되고 아직 아예 연결해제를 해보지는 않았는데 연결해제 이외에 방법은 없을까요? 잘때 수면패턴 측정을 설정해놓았는데 어제밤에 측정은 잘되고 표시만 저렇게 나오는거 같네요..,샤오미스토리 - 가성비 유저 커뮤니티,https://cafe.naver.com/xst
기어핏2 수면측정 데이터 삭제 가능한가요?,http://cafe.naver.com/happy88car/105774,제가 그냥 안차고 침대에 두고 나갔더니 그게 수면으로 인식이 되어버렸네요^^;; 혹시 어느부분만 삭제 가능한가요?,[스사노]스마트워치 사용자 노리터[타...,https://cafe.naver.com/happy88car
"[치코] 테루모 귀 체온계, 간편한 1초 측정, 소리없는 '수면모드' 이젠 편안해요~^^",http://cafe.naver.com/imsanbu/10520751,조용한 측정. '수면 모드' 는 물론... 혹시라도 측정한 뒤 전원끄는것을 깜박해도 전원꺼짐기능이 있어서 걱정이 없네요...^^ 아이의 청결한 측정과 위생을 위해~!! 이렇게 프로브 커버도 잔뜩~~ ^^;;... 프로브 커버가 얇기... ,맘스홀릭 베이비 (300만 엄마들의 임신...,https://cafe.naver.com/imsanbu
갤워치액티브 수면측정,http://cafe.naver.com/facebot/87725,게시글 7개 채우기 어렵고 저는 잠을 잘 못자는거 같습니다.,갤럭시워치 커뮤니티 [갤럭시워치5 / ...,https://cafe.naver.com/facebot
안녕하세요. 아두이노 플로터 및 수면 측정 질문드려요.,http://cafe.naver.com/arduinostory/90768,질문내용 : 심박수 측정으로 해서 임베디드 보드로 올리려고 하는데요. 플로터를 사용해서 그래프를 캡쳐해서 임베디드에 올려야할지 측정된 값을 받아서 임베디드에 올려야할 지 모르겠어서 질문드립니다. 1. 플로터에 뜬... ,아두이노 스토리,https://cafe.naver.com/arduinostory
야식 먹고 측정한 혈당수치는 어떻게 이해하죠?,http://cafe.naver.com/ebekoji/59819,했어요 수면은 새벽5시가 되어 잠이들었고 11시에 일어나서 11시40분에 혈당측정을 했는데 106이 나옵니다 원래 높게 나올수밖에없는 수치인건지 아니면 내당능장애를 의심해야하는지 궁금하네요 그리고 이럴경우 공복... ,당뇨와 당질제한식,https://cafe.naver.com/ebekoji
평균 수면 시간이 어떻게 되시나요?,http://cafe.naver.com/ebook/612098,"권장 수면 시간에 대한 의견이 분분한데, 어느 정도 평균은 있겠지만 결국 개인마다 다른 것 같아요. 사실 제 시간에 자고 제 시간에 일어나는 일이 정말 너무 어려웠거든요. 그런데 최근 수면에 관한 논픽션을 읽고... ",디지털감성 e북카페,https://cafe.naver.com/ebook
원래 깊은수면이 이렇게 짧은가요?,http://cafe.naver.com/dieselmania/32493984,미밴드 처음써봐서 이틀됬는데 수면측정 신기하면서도 충격이네요... 제가 문젠건가요? 아니면 원래 이런가요?,●디젤매니아● 대한민국 일등 패션 커...,https://cafe.naver.com/dieselmania
수면 기록 폰에서보기 앱을 열 수없습니다?,http://cafe.naver.com/anycallusershow/3814654,제목에는 간략한 질문내용 표시 사용기종 : 워치4 질문내용 : (구체적으로): 수면측정해보려고 차고잤습니다. 워치에 수면시간기록이 되어있는데 폰에서 보기를 누르면 폰에서 앱을 열 수 없다고 떠요ㅜㅜ 폰 삼성헬스앱... ,삼성스마트폰-Z플립4/갤폴드4/갤럭시S...,https://cafe.naver.com/anycallusershow
미밴드는 낮에 자는 건 측정을 안 하네요,http://cafe.naver.com/xst/61481,아침 7시에 자서 12시에 일어났는데 측정이 안 되어있네요이런 경우가 여러 번 있는 걸 봐선 주간 수면은 측정을 안 하나봐요 저 같이 밤낮이 뒤바뀐 사람에겐 아쉽네요 ㅠㅠ수면 측정의 정확도는 꽤 상당하던데...... ,샤오미스토리 - 가성비 유저 커뮤니티,https://cafe.naver.com/xst
코마트레이드구입 미밴드2수면오류,http://cafe.naver.com/xst/109525,손목흔들면 시계나오게 하는거 설정해놔서 자는동안 움직여서 그런건지.. 기기교환해야하는건지 알려주세요~ (수면측정 잘되게 체크해놓는건 해놨어요) 이곳에 내용을 작성하거나 사진을 첨부하시기 바랍니다,샤오미스토리 - 가성비 유저 커뮤니티,https://cafe.naver.com/xst
배터리 얼마나 가세요?,http://cafe.naver.com/facebot/1076620,"잠들기 전에 완충 후 착용. 수면측정 하고 다음날 일반적인 사용. 44mm 모델은 다음날 저녁에도 60%정도는 남아있는데, 클래식은 30%정도 또는 그 이하로 떨어져요. 클래식이 뭔가 일을 더 많이 하는걸까요?^^;",갤럭시워치 커뮤니티 [갤럭시워치5 / ...,https://cafe.naver.com/facebot
미밴드5 수면설정이 오래앉음과 충돌 되는것 같아요.,http://cafe.naver.com/xst/461926,"수면 측정이 잘 안되길래 일주일 지나면 되겠지 하고 기다렸죠. 역시 안되더군요. 이 카페에서, 차던 손목 말고 다른쪽 손목에 차고 마구 흔들어 보고 자라고 해서 했더니 2~3일 되더군요. 그러다가 또 안되길래 계속... ",샤오미스토리 - 가성비 유저 커뮤니티,https://cafe.naver.com/xst
스텝과 계단 측정 오류,http://cafe.naver.com/finisherclub/12080,간지나구 좋네요 ^^ 수면측정 너무 정확해서 깜짝놀랐어요 근데 스텝과 계단은 오류가 너무 많아요... 차로 이동할때 순식간에 +1000보 집안에서 +150보 그래서 하루 걷는시간 40분 미만인데 7000보 돌파 축하.... 엘베 거의... ,피니셔클럽,https://cafe.naver.com/finisherclub
GTS2E VS GTS3 둘 중에 뭘 살까요?,http://cafe.naver.com/xst/565634,"2년 정도 되니까 슬 바꿀때가 되서 알아보고 있는데요 사용범위는 시계, 알림, 수면측정 정도 쓰고 있습니다. 모델은 GT2E랑 GTS3 생각하고 있습니다. 조금 있으면 GTS4 나올것 같긴한데 혈압 측정 등 드라마틱한... ",샤오미스토리 - 가성비 유저 커뮤니티,https://cafe.naver.com/xst
가끔씩 수면체크가 안되는데 이유가 뭘까요...,http://cafe.naver.com/anycallusershow/4175205,제목에는 간략한 질문내용 표시 사용기종 : 워치4 질문내용 : (구체적으로): 가끔씩 수면체크가 안되어있는데 이유를 모르겠어요.. 전날까지 잘 썻는데 자고 일어나보면 체크가 안되어 있습니다... 뭐가 문제일까요,삼성스마트폰-Z플립4/갤폴드4/갤럭시S...,https://cafe.naver.com/anycallusershow
워치3 착용 후 렘수면 측정,http://cafe.naver.com/anycallusershow/3845579,워치3를 사용자입니다 잠깐 잠들었는데 수면측정이 되어버렸네요 자는동안 173칼로리 소모도 됐다네요 다이어트는 수면으로... ㅋㅋㅋㅋㅋ 렘수면이 움직인 기억이 없는데 그렇다고하니 놀랍습니다 워치 쓰시면 착용후... ,삼성스마트폰-Z플립4/갤폴드4/갤럭시S...,https://cafe.naver.com/anycallusershow
애플워치 필름,http://cafe.naver.com/appleiphone/7224248,근데 이거 수면 측정하려고 차고 자면 필름이 며칠에 한 번씩 들떠서 여러 개 들어있는 걸 사는데도 금방 다 써버리네요ㅜ 필름을 붙이면 수면 측정은 포기해야 하는 걸까요ㅠㅠ 안 떨어지는 필름 없을까요..?,아사모 -[아이폰14 / Plus / Pro / Ma...,https://cafe.naver.com/appleiphone
워치 수면코골이 기능,http://cafe.naver.com/anycallusershow/3870103,오면은 요즘 잠을 깊게 못자는 것 같아서 수면체크 하려고하는데 같이 자는 남편이 코골이가 있거든요 그럼 그 코골이가 제껄로 인식되서 잘못측정되기도 하나요? 워치 착용하고 주무시는 부부님들.. 요 부분... ,삼성스마트폰-Z플립4/갤폴드4/갤럭시S...,https://cafe.naver.com/anycallusershow
생각보다 수면측정이 잘 안되네요,http://cafe.naver.com/anycallusershow/3846486,질문/추천 금지 X 밤에 잘때는 갤핏2랑 측정 비슷하게 하는데 낮잠같은경우 갤핏보다 못잡네요..,삼성스마트폰-Z플립4/갤폴드4/갤럭시S...,https://cafe.naver.com/anycallusershow
워치 vs 핏,http://cafe.naver.com/anycallusershow/4116450,딴건 다필요없고 수면이랑 운동측정만 필요해서 핏을하냐 워치를하냐 고민이네요 수면 운동만이면 핏해도 상관없을꺼같은데 그래도 워치가 더정확할꺼같고..흠,삼성스마트폰-Z플립4/갤폴드4/갤럭시S...,https://cafe.naver.com/anycallusershow
수면기록,http://cafe.naver.com/facebot/969313,사용기종 : 워치4 40mm 실버 질문내용(구체적으로) : 수면측정이 하루는 잘되고 하루는 2시간 40분 되고 되다말다 해요ㅠ.ㅠ 땀띠날정도로 꽉 채우기도 했는데... 생초보라 고견 감사하겠습니다 ㅜ.ㅜ,갤럭시워치 커뮤니티 [갤럭시워치5 / ...,https://cafe.naver.com/facebot
베이비타임에 꿈수는 수면에 포함시키나요?,http://cafe.naver.com/imsanbu/62274178,그렇게 수유하고 트림시키는데도 딥슬립중이라 트림도 잘안해서 20분정도 안고있다 눕히면 그대로 또 잘 자는데 수면시간과 수유시간은 명확히 나눠서 생각해야할까요? 보통 수면시간을 어떻게 측정?하시나요?,맘스홀릭 베이비 (300만 엄마들의 임신...,https://cafe.naver.com/imsanbu
오토슬립 낮잠은 어떻게 측정하나요?,http://cafe.naver.com/appleiphone/7112184,낮잠을 어디서 확인하는거죠? 따로 설정해줘야 하나요? 낮잠까지 측정한다길래 차고 잤는데 들어가면 어젯밤에 잔 것만 나오고 어디로 들어가야하는지도 모르겠고 설정에 들어가도 딱히 안보이고..,아사모 -[아이폰14 / Plus / Pro / Ma...,https://cafe.naver.com/appleiphone
갤럭시워치5 사고 싶은데요 애플워치랑 고민중입니다,http://cafe.naver.com/dieselmania/39035760,"이번 갤럭시 워치5가 건강관리 쪽이 정확하고 많이 디테일 해졌다고 해서 (온도센서, 수면측정기능, 체성분&amp;혈압측정 등등 ) 살까 하는데 애플워치가 더 나은것 같기도 하고?! 어때요?",●디젤매니아● 대한민국 일등 패션 커...,https://cafe.naver.com/dieselmania
어메이즈핏 gts2 vs gts3,http://cafe.naver.com/xst/572197,"전화와 음악 저장 기능은 없어도 되고 시계, 심박수 상시 측정, 수면 체크, 알림, 기상 알람 정도만 주로 쓸 것 같은데 둘 중 뭐가 나을까요? gts2는 132000원, gts3는 166400원에 구매 가능합니다. 그리고 zepp os... ",샤오미스토리 - 가성비 유저 커뮤니티,https://cafe.naver.com/xst
수면측정이~~,http://cafe.naver.com/awuf/5284,"애플와치3 ,수면측정이 되나요? 수영할때만 사용해서 다른 기능은 모르겠네요 ㅎㅎ",애플워치 유저 포럼 Apple Watch User...,https://cafe.naver.com/awuf
"걷기,수면 등 기본어플 폰이랑 연동 문제..",http://cafe.naver.com/facebot/830369,"사용기종 : 워치4 질문내용(구체적으로) : 걷기,활동시간,칼로리 측정되는 앱이나 수면시간 측정 앱을 자세히 보려고 '폰에서 보기' 누르면 이렇게 뜨는건 왜일까요? 그리고 회사에다른분은 별다른 앱설치안했다는데... ",갤럭시워치 커뮤니티 [갤럭시워치5 / ...,https://cafe.naver.com/facebot
